{
  "agent_argv_options": [
    "--config",
    "--workspace",
    "--data-dir",
    "--prompt-file",
    "--report-out",
    "--yes",
    "--ack-unsafe-auto-approve"
  ],
  "agent_commit": "2ef8da8bd0c8cdbc9592fcb767214c0ea518e5be",
  "agent_exit_code": 0,
  "agent_report": {
    "compaction": {
      "above_target": false,
      "count": 0,
      "estimate_error": {
        "estimated_minus_provider_tokens": null,
        "estimated_summary_tokens": null,
        "provider_summary_output_tokens": null
      },
      "estimator_id": null,
      "input_tokens_after": null,
      "input_tokens_before": null,
      "requests": 0
    },
    "durations": {
      "agent_monotonic_ms": 22685,
      "compaction_request_elapsed_ms": 0,
      "model_request_elapsed_ms": 20613,
      "retry_wait_monotonic_ms": 0,
      "tool_execution_monotonic_ms": 80
    },
    "error_kind": null,
    "final_assistant_text": "Both coordinated edits are complete and verified:\n\n1. **`src/fetch/config.py`** — renamed the constant to `REQUEST_TIMEOUT` and raised its value to `45` (`MAX_ATTEMPTS` untouched).\n2. **`src/fetch/client.py`** — removed the local `TIMEOUT_SECONDS = 30` copy and now imports `REQUEST_TIMEOUT` from `fetch.config`, using that for the returned timeout.\n\nVerification results:\n- `grep` finds no `TIMEOUT_SECONDS` anywhere in `src/` or `tests/`.\n- `fetch.config` exports `REQUEST_TIMEOUT == 45`, and `fetch(\"...\")` returns `{'url': 'https://example.com', 'timeout': 45}`.\n- Existing suite passes: `Ran 3 tests ... OK`.\n- `README.md` and `tests/` were not modified.",
    "finished_at": "2026-08-31T16:03:40.193149+00:00",
    "model": {
      "compaction": {
        "attempts": 0,
        "elapsed_ms": 0,
        "network_retries": 0,
        "requests": 0,
        "results": {},
        "usage": {
          "cache_creation_input_tokens": null,
          "cache_read_input_tokens": null,
          "input_tokens": null,
          "output_tokens": null
        },
        "usage_coverage": null
      },
      "main": {
        "attempts": 6,
        "elapsed_ms": 20613,
        "network_retries": 0,
        "requests": 6,
        "results": {
          "succeeded": 6
        },
        "usage": {
          "cache_creation_input_tokens": 0,
          "cache_read_input_tokens": 7168,
          "input_tokens": 6083,
          "output_tokens": 1079
        },
        "usage_coverage": 1.0
      }
    },
    "model_identity": {
      "context_window": 1000000,
      "max_output_tokens": 32768,
      "name": "deepseek-v4-pro-0813",
      "stream": true
    },
    "run_id": "d0e779bf-699f-4728-b81e-d4c14355238e",
    "schema_version": "run-report-v1",
    "session_id": "ceb6d18a-2f7f-4ce4-b001-df19f2194965",
    "started_at": "2026-08-31T16:03:18.650827+00:00",
    "state": "COMPLETED",
    "stop_reason": "COMPLETED",
    "tool_schema_hash": "2d824d77ddcd143d5686b350c0415ee1e599371e4468a0a0c899001622cd3834",
    "tools": {
      "by_name": {
        "read_file": {
          "failed": 0,
          "proposed": 3,
          "succeeded": 3
        },
        "run_command": {
          "failed": 0,
          "proposed": 2,
          "succeeded": 2
        },
        "write_file": {
          "failed": 0,
          "proposed": 2,
          "succeeded": 2
        }
      },
      "calls": [
        {
          "args_hash": "168a917291b4328c788c532411d7bed804b18e5ae3be8c70564ad6952004eeac",
          "duration_ms": 0,
          "executed": true,
          "name": "read_file",
          "output_bytes": null,
          "state": "succeeded",
          "truncated": false
        },
        {
          "args_hash": "926de8d8d833020a807f294ad7f278613ac79d7107c97056f6bed75c6d8b268c",
          "duration_ms": 0,
          "executed": true,
          "name": "read_file",
          "output_bytes": null,
          "state": "succeeded",
          "truncated": false
        },
        {
          "args_hash": "ef0aad90c7a33f80fa14104e766d115ce0d3506f7bcc0670d65c704d43984842",
          "duration_ms": 5,
          "executed": true,
          "name": "run_command",
          "output_bytes": 215,
          "state": "succeeded",
          "truncated": false
        },
        {
          "args_hash": "2dede11454ae6dbfefa23b270d0e1c9d1e0f75cf4676d9b4a279103a5f86c1c0",
          "duration_ms": 0,
          "executed": true,
          "name": "read_file",
          "output_bytes": null,
          "state": "succeeded",
          "truncated": false
        },
        {
          "args_hash": "b51ba8bca218923086b3201726c0d7007738d74d7559c7939c402a877c56e6b9",
          "duration_ms": 9,
          "executed": true,
          "name": "write_file",
          "output_bytes": null,
          "state": "succeeded",
          "truncated": false
        },
        {
          "args_hash": "1db1928ea29a12c61d24dd442309709615559e26d51b0ec4d8c73495e4e54b49",
          "duration_ms": 9,
          "executed": true,
          "name": "write_file",
          "output_bytes": null,
          "state": "succeeded",
          "truncated": false
        },
        {
          "args_hash": "68734aa8e05348ab1f5fdd5785016f17c82841f6dd90179d37d3e6da38a4149e",
          "duration_ms": 57,
          "executed": true,
          "name": "run_command",
          "output_bytes": 327,
          "state": "succeeded",
          "truncated": false
        }
      ],
      "cancelled": 0,
      "duplicate_calls": 0,
      "duration_ms": 80,
      "executed": 7,
      "failed": 0,
      "output_bytes": 542,
      "proposed": 7,
      "rejected": 0,
      "skipped": 0,
      "succeeded": 7,
      "truncated": 0,
      "unknown": 0
    }
  },
  "agent_timed_out": false,
  "artifact_correct": true,
  "campaign_id": "campaign-f1f83b561e2e",
  "category": "locate_and_modify",
  "compaction": {
    "above_target": false,
    "count": 0,
    "estimated_minus_provider_tokens": null,
    "estimated_summary_tokens": null,
    "input_tokens_after": null,
    "input_tokens_before": null,
    "provider_summary_output_tokens": null,
    "requests": 0
  },
  "durations": {
    "agent_monotonic_ms": 22685,
    "agent_process_ms": 23893,
    "oracle_ms": 63,
    "retry_wait_monotonic_ms": 0,
    "tool_execution_monotonic_ms": 80,
    "total_ms": 23963,
    "workspace_prepare_ms": 6
  },
  "error_kind": null,
  "failure_kind": null,
  "failure_stage": null,
  "finished_at": "2026-08-31T16:03:40.559911+00:00",
  "harness_detail": null,
  "hashes": {
    "baseline_tree": "f13bf700c31916378dbe52c4e4518cc7184599a3d26d51c1eea62b309be566ef",
    "config": "865d5de5591602edebc5aa79b3440ba586dc45182c945540532450b14c4249ed",
    "diff": "1d12ae8fef128a7decf0ad47059c98166efe7908d3abe79ff806b09b2c1e8b91",
    "prompt": "a725388f679c0bd8017ca8118c8572465dee0b1f6cb16a28a155d5344cd58d52",
    "task": "7f1193376c9e1fe66e935c1a62579ed2cd3cb5c1a7da8119a93ad0446a3238b6",
    "tool_schema": "2d824d77ddcd143d5686b350c0415ee1e599371e4468a0a0c899001622cd3834",
    "workspace_tree": "228aa4699d9fcd669974f240d274fcb55878532d2971d719a9b503dafdc39926"
  },
  "model": {
    "attempts": 6,
    "compaction_requests": 0,
    "main_requests": 6,
    "network_retries": 0,
    "usage": {
      "cache_creation_input_tokens": 0,
      "cache_read_input_tokens": 7168,
      "input_tokens": 6083,
      "output_tokens": 1079
    },
    "usage_coverage": 1.0
  },
  "model_identity": {
    "context_window": 1000000,
    "max_output_tokens": 32768,
    "name": "deepseek-v4-pro-0813",
    "stream": true
  },
  "modifications": {
    "detected_workspace_escape": false,
    "files_added": 0,
    "files_deleted": 0,
    "files_modified": 2,
    "forbidden_paths_modified": [],
    "lines_added": 4,
    "lines_removed": 4,
    "out_of_scope_paths": []
  },
  "oracle": {
    "regression": {
      "duration_ms": 40,
      "errored": false,
      "exit_code": 0,
      "passed": true
    },
    "target": {
      "duration_ms": 21,
      "errored": false,
      "exit_code": 0,
      "passed": true
    }
  },
  "outcome": "OK",
  "provider": "anthropic_messages",
  "repeat": 1,
  "schema_version": "run-v1",
  "started_at": "2026-08-31T16:03:17.723908+00:00",
  "state": "COMPLETED",
  "stop_reason": "COMPLETED",
  "strict_success": true,
  "task_id": "locate-rename-timeout",
  "tools": {
    "duplicate_calls": 0,
    "executed": 7,
    "failed": 0,
    "output_bytes": 542,
    "proposed": 7,
    "skipped": 0,
    "succeeded": 7,
    "truncated": 0
  }
}
