{
  "agent_argv_options": [
    "--config",
    "--workspace",
    "--data-dir",
    "--prompt-file",
    "--report-out",
    "--yes",
    "--ack-unsafe-auto-approve"
  ],
  "agent_commit": "2ef8da8bd0c8cdbc9592fcb767214c0ea518e5be",
  "agent_exit_code": 0,
  "agent_report": {
    "compaction": {
      "above_target": false,
      "count": 0,
      "estimate_error": {
        "estimated_minus_provider_tokens": null,
        "estimated_summary_tokens": null,
        "provider_summary_output_tokens": null
      },
      "estimator_id": null,
      "input_tokens_after": null,
      "input_tokens_before": null,
      "requests": 0
    },
    "durations": {
      "agent_monotonic_ms": 23476,
      "compaction_request_elapsed_ms": 0,
      "model_request_elapsed_ms": 22621,
      "retry_wait_monotonic_ms": 0,
      "tool_execution_monotonic_ms": 80
    },
    "error_kind": null,
    "final_assistant_text": "Done. I created `src/wordkit/counter.py` with a single public function:\n\n```python\ndef word_counts(text: str) -> dict[str, int]:\n    counts: dict[str, int] = {}\n    for word in text.split():\n        key = word.lower()\n        counts[key] = counts.get(key, 0) + 1\n    return counts\n```\n\nHow it meets the requirements:\n1. **Splits on whitespace runs** — `text.split()` (same approach as the existing `words.split_words`).\n2. **Case-insensitive counting** — each token is lowercased before being used as the dictionary key.\n3. **Empty result for no words** — the loop body never runs for whitespace-only or empty text, so `{}` is returned.\n\nVerification:\n- Existing suite: `PYTHONPATH=src python3 -B -m unittest discover -s tests -t tests` → 3 tests, OK.\n- Behavior check: `word_counts(\"Tea tea TIME\")` → `{'tea': 2, 'time': 1}`, and both `word_counts(\"  \")` and `word_counts(\"\")` → `{}`.\n\nNo existing files were changed, and `README.md` and `tests/` were left untouched.",
    "finished_at": "2026-08-31T15:58:02.935425+00:00",
    "model": {
      "compaction": {
        "attempts": 0,
        "elapsed_ms": 0,
        "network_retries": 0,
        "requests": 0,
        "results": {},
        "usage": {
          "cache_creation_input_tokens": null,
          "cache_read_input_tokens": null,
          "input_tokens": null,
          "output_tokens": null
        },
        "usage_coverage": null
      },
      "main": {
        "attempts": 5,
        "elapsed_ms": 22621,
        "network_retries": 0,
        "requests": 5,
        "results": {
          "succeeded": 5
        },
        "usage": {
          "cache_creation_input_tokens": 0,
          "cache_read_input_tokens": 6144,
          "input_tokens": 4602,
          "output_tokens": 1274
        },
        "usage_coverage": 1.0
      }
    },
    "model_identity": {
      "context_window": 1000000,
      "max_output_tokens": 32768,
      "name": "deepseek-v4-pro-0813",
      "stream": true
    },
    "run_id": "a278fe8b-b8ae-43f3-8a52-22fbe3d9fbb9",
    "schema_version": "run-report-v1",
    "session_id": "23f26046-ea41-4940-8877-3277fe1f2033",
    "started_at": "2026-08-31T15:57:39.478496+00:00",
    "state": "COMPLETED",
    "stop_reason": "COMPLETED",
    "tool_schema_hash": "2d824d77ddcd143d5686b350c0415ee1e599371e4468a0a0c899001622cd3834",
    "tools": {
      "by_name": {
        "read_file": {
          "failed": 0,
          "proposed": 3,
          "succeeded": 3
        },
        "run_command": {
          "failed": 0,
          "proposed": 2,
          "succeeded": 2
        },
        "skill": {
          "failed": 0,
          "proposed": 1,
          "succeeded": 1
        },
        "write_file": {
          "failed": 0,
          "proposed": 1,
          "succeeded": 1
        }
      },
      "calls": [
        {
          "args_hash": "f130f6ccbc20ff24ca4cf81ddc7cc8f867e04938ec44d7bca07b8acfd62b366c",
          "duration_ms": 5,
          "executed": true,
          "name": "run_command",
          "output_bytes": 83,
          "state": "succeeded",
          "truncated": false
        },
        {
          "args_hash": "a1587c423db147bbb76df9e75579de29c604fb0f73fd81441a7f796d7d67a898",
          "duration_ms": 0,
          "executed": true,
          "name": "skill",
          "output_bytes": null,
          "state": "succeeded",
          "truncated": false
        },
        {
          "args_hash": "2e6c970d3c1c631d8ebf6016f49c0db1f1b9a3870cc353539d8c4e756c24c001",
          "duration_ms": 0,
          "executed": true,
          "name": "read_file",
          "output_bytes": null,
          "state": "succeeded",
          "truncated": false
        },
        {
          "args_hash": "fc66d8269525fbfb4c9d7ae0928cfed2b8f60214693fe11c2551ec0e62cef66a",
          "duration_ms": 0,
          "executed": true,
          "name": "read_file",
          "output_bytes": null,
          "state": "succeeded",
          "truncated": false
        },
        {
          "args_hash": "054f5b8456cb53d78ef7b7419b2eccbcae2ab5c93a66c094aba0a34d052d4579",
          "duration_ms": 0,
          "executed": true,
          "name": "read_file",
          "output_bytes": null,
          "state": "succeeded",
          "truncated": false
        },
        {
          "args_hash": "1446da9ae62ece9487a13cd7dfcdeb148a49e72f13b3dddc0c978a83ddcec0f7",
          "duration_ms": 12,
          "executed": true,
          "name": "write_file",
          "output_bytes": null,
          "state": "succeeded",
          "truncated": false
        },
        {
          "args_hash": "344015158141409bba9bf4c89f0b1bef1dc884c1fa8d8837caaaa4ec051c818d",
          "duration_ms": 63,
          "executed": true,
          "name": "run_command",
          "output_bytes": 129,
          "state": "succeeded",
          "truncated": false
        }
      ],
      "cancelled": 0,
      "duplicate_calls": 0,
      "duration_ms": 80,
      "executed": 7,
      "failed": 0,
      "output_bytes": 212,
      "proposed": 7,
      "rejected": 0,
      "skipped": 0,
      "succeeded": 7,
      "truncated": 0,
      "unknown": 0
    }
  },
  "agent_timed_out": false,
  "artifact_correct": true,
  "campaign_id": "campaign-f1f83b561e2e",
  "category": "new_file",
  "compaction": {
    "above_target": false,
    "count": 0,
    "estimated_minus_provider_tokens": null,
    "estimated_summary_tokens": null,
    "input_tokens_after": null,
    "input_tokens_before": null,
    "provider_summary_output_tokens": null,
    "requests": 0
  },
  "durations": {
    "agent_monotonic_ms": 23476,
    "agent_process_ms": 24890,
    "oracle_ms": 70,
    "retry_wait_monotonic_ms": 0,
    "tool_execution_monotonic_ms": 80,
    "total_ms": 24964,
    "workspace_prepare_ms": 5
  },
  "error_kind": null,
  "failure_kind": null,
  "failure_stage": null,
  "finished_at": "2026-08-31T15:58:03.370979+00:00",
  "harness_detail": null,
  "hashes": {
    "baseline_tree": "18c3bfd3c71fe287e29f0542a6bc001d51ac50c813c219e165bf54da50fceec2",
    "config": "865d5de5591602edebc5aa79b3440ba586dc45182c945540532450b14c4249ed",
    "diff": "19acdc664b46982a190c58c240fe7bcc6f5b3e2bce84b63ae07b55298a99a00a",
    "prompt": "e67ff190dbbed751e625ee2bf39706b20e4460c72ebd9ac4a28a7631db369b0a",
    "task": "0f956c8c776977e41eb7e3ba33ddd470a753b3292634b3178ca7eb076c9c4734",
    "tool_schema": "2d824d77ddcd143d5686b350c0415ee1e599371e4468a0a0c899001622cd3834",
    "workspace_tree": "9785a2729914a1b035b0724d62450734f6014524cc595d0e89483612843cc243"
  },
  "model": {
    "attempts": 5,
    "compaction_requests": 0,
    "main_requests": 5,
    "network_retries": 0,
    "usage": {
      "cache_creation_input_tokens": 0,
      "cache_read_input_tokens": 6144,
      "input_tokens": 4602,
      "output_tokens": 1274
    },
    "usage_coverage": 1.0
  },
  "model_identity": {
    "context_window": 1000000,
    "max_output_tokens": 32768,
    "name": "deepseek-v4-pro-0813",
    "stream": true
  },
  "modifications": {
    "detected_workspace_escape": false,
    "files_added": 1,
    "files_deleted": 0,
    "files_modified": 0,
    "forbidden_paths_modified": [],
    "lines_added": 10,
    "lines_removed": 0,
    "out_of_scope_paths": []
  },
  "oracle": {
    "regression": {
      "duration_ms": 43,
      "errored": false,
      "exit_code": 0,
      "passed": true
    },
    "target": {
      "duration_ms": 25,
      "errored": false,
      "exit_code": 0,
      "passed": true
    }
  },
  "outcome": "OK",
  "provider": "anthropic_messages",
  "repeat": 1,
  "schema_version": "run-v1",
  "started_at": "2026-08-31T15:57:38.406630+00:00",
  "state": "COMPLETED",
  "stop_reason": "COMPLETED",
  "strict_success": true,
  "task_id": "new-file-wordcount",
  "tools": {
    "duplicate_calls": 0,
    "executed": 7,
    "failed": 0,
    "output_bytes": 212,
    "proposed": 7,
    "skipped": 0,
    "succeeded": 7,
    "truncated": 0
  }
}
