{
  "agent_argv_options": [
    "--config",
    "--workspace",
    "--data-dir",
    "--prompt-file",
    "--report-out",
    "--yes",
    "--ack-unsafe-auto-approve",
    "--command-policy"
  ],
  "agent_commit": "9516f1bed6e9b8b3216495c4610698953c7d12b2",
  "agent_exit_code": 0,
  "agent_report": {
    "compaction": {
      "above_target": false,
      "count": 0,
      "estimate_error": {
        "estimated_minus_provider_tokens": null,
        "estimated_summary_tokens": null,
        "provider_summary_output_tokens": null
      },
      "estimator_id": null,
      "input_tokens_after": null,
      "input_tokens_before": null,
      "requests": 0
    },
    "durations": {
      "agent_monotonic_ms": 13424,
      "compaction_request_elapsed_ms": 0,
      "model_request_elapsed_ms": 12252,
      "retry_wait_monotonic_ms": 0,
      "tool_execution_monotonic_ms": 52
    },
    "error_kind": null,
    "final_assistant_text": "Fixed the off-by-one in `validate_77`: the comparison is now `0 <= value < limit`, so `validate_77(87)` correctly returns `False`.\n\n- Only `validate_77` was changed; the other 119 validators, `README.md`, and `tests/` were left untouched.\n- Verified with the full suite: `Ran 3 tests ... OK`.",
    "finished_at": "2026-08-31T14:39:08.522169+00:00",
    "model": {
      "compaction": {
        "attempts": 0,
        "elapsed_ms": 0,
        "network_retries": 0,
        "requests": 0,
        "results": {},
        "usage": {
          "cache_creation_input_tokens": null,
          "cache_read_input_tokens": null,
          "input_tokens": null,
          "output_tokens": null
        },
        "usage_coverage": null
      },
      "main": {
        "attempts": 4,
        "elapsed_ms": 12252,
        "network_retries": 0,
        "requests": 4,
        "results": {
          "succeeded": 4
        },
        "usage": {
          "cache_creation_input_tokens": 0,
          "cache_read_input_tokens": 15360,
          "input_tokens": 8767,
          "output_tokens": 621
        },
        "usage_coverage": 1.0
      }
    },
    "model_identity": {
      "context_window": 1000000,
      "max_output_tokens": 32768,
      "name": "deepseek-v4-pro-0813",
      "stream": true
    },
    "run_id": "b223fc03-973a-42dd-a851-3abf807ef039",
    "schema_version": "run-report-v1",
    "session_id": "3da96e39-5c8a-4ec1-b999-fb267f25e06f",
    "started_at": "2026-08-31T14:38:55.668921+00:00",
    "state": "COMPLETED",
    "stop_reason": "COMPLETED",
    "tool_schema_hash": "2d824d77ddcd143d5686b350c0415ee1e599371e4468a0a0c899001622cd3834",
    "tools": {
      "by_name": {
        "read_file": {
          "failed": 0,
          "proposed": 2,
          "succeeded": 2
        },
        "run_command": {
          "failed": 0,
          "proposed": 1,
          "succeeded": 1
        },
        "write_file": {
          "failed": 0,
          "proposed": 1,
          "succeeded": 1
        }
      },
      "calls": [
        {
          "args_hash": "7e35474361e84b9f553a6adebe3b6e4ee08cebcc0012c16a697aee50862009f2",
          "duration_ms": 0,
          "executed": true,
          "name": "read_file",
          "output_bytes": null,
          "state": "succeeded",
          "truncated": false
        },
        {
          "args_hash": "81fc87cc34a811f5c90eb4d00401b510de0ce2b97c3c304547cda70e57176415",
          "duration_ms": 9,
          "executed": true,
          "name": "write_file",
          "output_bytes": null,
          "state": "succeeded",
          "truncated": false
        },
        {
          "args_hash": "34575362d2e1afba14e3acd21dbe5b35f7969c035d5ca7b84c0463fbab9f553e",
          "duration_ms": 0,
          "executed": true,
          "name": "read_file",
          "output_bytes": null,
          "state": "succeeded",
          "truncated": true
        },
        {
          "args_hash": "0225c4e6253de9f386b6f02582fd1b225478d9530ae32952230d2e9ceb7c57d8",
          "duration_ms": 43,
          "executed": true,
          "name": "run_command",
          "output_bytes": 101,
          "state": "succeeded",
          "truncated": false
        }
      ],
      "cancelled": 0,
      "duplicate_calls": 0,
      "duration_ms": 52,
      "executed": 4,
      "failed": 0,
      "output_bytes": 101,
      "proposed": 4,
      "rejected": 0,
      "skipped": 0,
      "succeeded": 4,
      "truncated": 1,
      "unknown": 0
    }
  },
  "agent_timed_out": false,
  "artifact_correct": true,
  "campaign_id": "campaign-bc14479878a2",
  "category": "large_file_edit",
  "compaction": {
    "above_target": false,
    "count": 0,
    "estimated_minus_provider_tokens": null,
    "estimated_summary_tokens": null,
    "input_tokens_after": null,
    "input_tokens_before": null,
    "provider_summary_output_tokens": null,
    "requests": 0
  },
  "durations": {
    "agent_monotonic_ms": 13424,
    "agent_process_ms": 14510,
    "oracle_ms": 71,
    "retry_wait_monotonic_ms": 0,
    "tool_execution_monotonic_ms": 52,
    "total_ms": 14586,
    "workspace_prepare_ms": 4
  },
  "error_kind": null,
  "failure_kind": null,
  "failure_stage": null,
  "finished_at": "2026-08-31T14:39:08.854243+00:00",
  "harness_detail": null,
  "hashes": {
    "baseline_tree": "422ec701c1d191102dfa703d1cbe3cbdb64d7a1c1e62f635c5c6fe07c805d4d3",
    "config": "865d5de5591602edebc5aa79b3440ba586dc45182c945540532450b14c4249ed",
    "diff": "e9cfd2adc590a5a1158702e3d7446743e05875c4473103a8b83c8bffab8c1f31",
    "prompt": "d60f80f2c6fed70948a1111d50aafbf8986ba773645c1c958133c6dcc82730dd",
    "task": "081f405aff067091b39141bf1e3f1a2ff6294bfac0e621072e90fe2e18ea1eab",
    "tool_schema": "2d824d77ddcd143d5686b350c0415ee1e599371e4468a0a0c899001622cd3834",
    "workspace_tree": "9db4c3227dfd6d93db4d15a148d0cb641f1091fdb74c4daaa0b6ff72cdc4ca1e"
  },
  "model": {
    "attempts": 4,
    "compaction_requests": 0,
    "main_requests": 4,
    "network_retries": 0,
    "usage": {
      "cache_creation_input_tokens": 0,
      "cache_read_input_tokens": 15360,
      "input_tokens": 8767,
      "output_tokens": 621
    },
    "usage_coverage": 1.0
  },
  "model_identity": {
    "context_window": 1000000,
    "max_output_tokens": 32768,
    "name": "deepseek-v4-pro-0813",
    "stream": true
  },
  "modifications": {
    "detected_workspace_escape": false,
    "files_added": 0,
    "files_deleted": 0,
    "files_modified": 1,
    "forbidden_paths_modified": [],
    "lines_added": 1,
    "lines_removed": 1,
    "out_of_scope_paths": []
  },
  "oracle": {
    "regression": {
      "duration_ms": 42,
      "errored": false,
      "exit_code": 0,
      "passed": true
    },
    "target": {
      "duration_ms": 25,
      "errored": false,
      "exit_code": 0,
      "passed": true
    }
  },
  "outcome": "OK",
  "provider": "anthropic_messages",
  "repeat": 1,
  "schema_version": "run-v1",
  "started_at": "2026-08-31T14:38:54.822064+00:00",
  "state": "COMPLETED",
  "stop_reason": "COMPLETED",
  "strict_success": true,
  "task_id": "large-file-validators",
  "tools": {
    "duplicate_calls": 0,
    "executed": 4,
    "failed": 0,
    "output_bytes": 101,
    "proposed": 4,
    "skipped": 0,
    "succeeded": 4,
    "truncated": 1
  }
}
